{"config":{"difficulty":null,"group_id":null,"language":"en","seed":"web-launch-v1","theme":null,"timer_seconds":20},"dataset_version":"38d69cd50a7d7a4ee06827a88e00186352eed9b1d7b85f7d533a4c21036da403","questions":[{"answer_option_id":"07f30f9481a4aad487f20b8bc93e553a7afa3bae3a282bc3f373c7878853e4b9","difficulty":"medium","evidence":[{"fact_base_id":"Q27890328$783FE62B-C8D2-4D66-8590-B873F89E53FA","locator":"wikipedia:en:pageid=52281853:revid=1368997934#extract[65:70]","revision_id":1368997934,"source_key":"wikipedia:en","source_url":"https://en.wikipedia.org/w/index.php?curid=52281853&oldid=1368997934"}],"explanation":"The source associates Autumn Story with Astro.","fact_base_ids":["Q27890328$783FE62B-C8D2-4D66-8590-B873F89E53FA"],"group_ids":["Q23004252"],"id":"64e0142bf20881c5913848f42e4495e305a743fda8765bb7ecae50a8953eed63","language":"en","logical_id":"07dd1962da393362c1f214a6ce56dca4c659d047a2436573acd5bcced095077e","options":[{"id":"8cae46e2915233c7ceb3b3e6c21afc8a98cd29de147ac332cf386c379b961e51","label":"2NE1","value":"Q171885","value_type":"group"},{"id":"07f30f9481a4aad487f20b8bc93e553a7afa3bae3a282bc3f373c7878853e4b9","label":"Astro","value":"Q23004252","value_type":"group"},{"id":"b73c87cd6ca3bfc36385cdc2a9b1790c8710e8e9ba7df62eafd2c6c5270a12d4","label":"After School","value":"Q389067","value_type":"group"},{"id":"e0715598698b61ddbdefe8802976b4328ad73f66b1d6529fae4cd34d8453e405","label":"2AM","value":"Q498701","value_type":"group"}],"prompt":"Which of these groups released Autumn Story?","reference_date":"2026-09-13","semantic_id":"e65d5f03775c024ec5e33eef91322f7b42d7b95dfa2a62e6349cc37212fa0e3d","theme":"discography","type":"group_for_release"},{"answer_option_id":"358938bed44e7de46d5c9129b338813ef7fbc0ff9d2d62dd1b99d6df22c821b1","difficulty":"hard","evidence":[{"fact_base_id":"Q1392821$fe7d96ee-47a1-1170-6ab1-c827f25c5958","locator":"wikipedia:en:pageid=35798957:revid=1326125766#extract[101:112]","revision_id":1326125766,"source_key":"wikipedia:en","source_url":"https://en.wikipedia.org/w/index.php?curid=35798957&oldid=1326125766"},{"fact_base_id":"Q2482558$A6DAFC23-993E-4033-83F5-A16D4E88FA7E","locator":"wikipedia:en:pageid=32153136:revid=1368294978#extract[82:94]","revision_id":1368294978,"source_key":"wikipedia:en","source_url":"https://en.wikipedia.org/w/index.php?curid=32153136&oldid=1368294978"},{"fact_base_id":"Q487092$1AF76AF2-B0FF-4FF0-A09C-8CEEB0F28EED","locator":"wikipedia:en:pageid=31970787:revid=1350912932#extract[238:251]","revision_id":1350912932,"source_key":"wikipedia:en","source_url":"https://en.wikipedia.org/w/index.php?curid=31970787&oldid=1350912932"},{"fact_base_id":"Q488127$87fa2ead-40cb-a256-e9f6-38386265fb00","locator":"wikipedia:en:pageid=31503859:revid=1236200865#extract[94:108]","revision_id":1236200865,"source_key":"wikipedia:en","source_url":"https://en.wikipedia.org/w/index.php?curid=31503859&oldid=1236200865"}],"explanation":"In chronological order: Seven Springs of Apink (19 April 2011); Virgin (29 April 2011); Take Off (18 May 2011); Une Année (9 May 2012).","fact_base_ids":["Q1392821$fe7d96ee-47a1-1170-6ab1-c827f25c5958","Q2482558$A6DAFC23-993E-4033-83F5-A16D4E88FA7E","Q487092$1AF76AF2-B0FF-4FF0-A09C-8CEEB0F28EED","Q488127$87fa2ead-40cb-a256-e9f6-38386265fb00"],"group_ids":["Q222760","Q389067","Q483286"],"id":"466e9deec7e9ac5ce5fa949394eb493f03047edd8df4ed42e7f2bb3bc1da9152","language":"en","logical_id":"3b671942a9e1fe4831999b62ecbc7d69609aa6e4dad518e2dc40b512deb12179","options":[{"id":"ad107e4c58ff62fe3ceee28aad4fc7df8a77afa5474886fd79a5e848ce29c6b6","label":"Une Année","value":"Q1392821","value_type":"release"},{"id":"358938bed44e7de46d5c9129b338813ef7fbc0ff9d2d62dd1b99d6df22c821b1","label":"Seven Springs of Apink","value":"Q488127","value_type":"release"},{"id":"3f3d1e362be1ecdc4b8b404a2688e2534ea9f6923023007ad0d9681f630ac7ad","label":"Virgin","value":"Q487092","value_type":"release"},{"id":"24cf9f9aeff10f20e102034297edbb5a6752014fa4dd68dd81b0708e88ee741d","label":"Take Off","value":"Q2482558","value_type":"release"}],"prompt":"Which of these releases came out first?","reference_date":"2026-09-13","semantic_id":"0579409440e9ee75b2b711a4e1cf78a5344a20550e698108a060405646450a7f","theme":"discography","type":"earliest_release"},{"answer_option_id":"ada70d5d98ec240e3583cf5888a73f5d621591864c6884dd0736e1bc0f3d08a7","difficulty":"medium","evidence":[{"fact_base_id":"Q13024330$bd17bfa1-4a7b-486e-97aa-166741fcfea6","locator":"wikipedia:en:pageid=27353909:revid=1371661797#extract[47:50]","revision_id":1371661797,"source_key":"wikipedia:en","source_url":"https://en.wikipedia.org/w/index.php?curid=27353909&oldid=1371661797"}],"explanation":"The source associates Heartbeat with 2PM.","fact_base_ids":["Q13024330$bd17bfa1-4a7b-486e-97aa-166741fcfea6"],"group_ids":["Q222760"],"id":"db72001489fd9ceea1d6ba1f386407cc2bb18d064d9e24ac524f5c841d3d61f5","language":"en","logical_id":"faaecbfba550f5e974c5b2e915ae65c2de43fb4a63d05d5f2c2beff36789d5c9","options":[{"id":"b73c87cd6ca3bfc36385cdc2a9b1790c8710e8e9ba7df62eafd2c6c5270a12d4","label":"After School","value":"Q389067","value_type":"group"},{"id":"ada70d5d98ec240e3583cf5888a73f5d621591864c6884dd0736e1bc0f3d08a7","label":"2PM","value":"Q222760","value_type":"group"},{"id":"afc5f9e1c9344d90dc180d8e80d1d91e40680b8a60c4141c1afa7889d217b402","label":"April","value":"Q20858387","value_type":"group"},{"id":"8cae46e2915233c7ceb3b3e6c21afc8a98cd29de147ac332cf386c379b961e51","label":"2NE1","value":"Q171885","value_type":"group"}],"prompt":"Which of these groups released Heartbeat?","reference_date":"2026-09-13","semantic_id":"7b173fcbb6d0fead24d88b67a069fafa6a7170ebe49051f58acb49013174cb5f","theme":"discography","type":"group_for_release"},{"answer_option_id":"7ab061d739eb7c1a7dcfb013ad8766d4014c63aa3c6bec479c57e9e538fdf134","difficulty":"easy","evidence":[{"fact_base_id":"Q15707531$80721e10-4842-c629-c5fb-88511adf9809","locator":"wikipedia:en:pageid=40201503:revid=1364388076#extract[54:58]","revision_id":1364388076,"source_key":"wikipedia:en","source_url":"https://en.wikipedia.org/w/index.php?curid=40201503&oldid=1364388076"}],"explanation":"The source associates Do You Love Me with 2NE1.","fact_base_ids":["Q15707531$80721e10-4842-c629-c5fb-88511adf9809"],"group_ids":["Q171885"],"id":"c9beded6683eb161c7c7df07b0738033a246b6091a9a3adf8fdf13a27374376b","language":"en","logical_id":"2b91f3971337cf612dc10a77b37621a81bbad306b1e0ed91de20c89d92f4a6e5","options":[{"id":"a18449863e79b1bad46cfcabdf55ccbb9a17908c3569b66269bc31778e6fe16f","label":"Drive to the Starry Road","value":"Q112133509","value_type":"release"},{"id":"abf5f1a2b4942f69dda90d0af3ed5c375ab5593da7e4bbfd326fe8845d32d2b2","label":"Hands Up","value":"Q5647595","value_type":"release"},{"id":"bbb3b5b609375dc54a1ef5f80bc11e60c5bddc9ed6a609cb8eb060e45ccdcaa8","label":"Name is 4Minute","value":"Q13421962","value_type":"release"},{"id":"7ab061d739eb7c1a7dcfb013ad8766d4014c63aa3c6bec479c57e9e538fdf134","label":"Do You Love Me","value":"Q15707531","value_type":"release"}],"prompt":"Which of these releases is by 2NE1?","reference_date":"2026-09-13","semantic_id":"bf03ce162964196331be6a18b16dd2b27b63959f5da0d3f84cfbf3870f48bd87","theme":"discography","type":"release_for_group"},{"answer_option_id":"ada70d5d98ec240e3583cf5888a73f5d621591864c6884dd0736e1bc0f3d08a7","difficulty":"medium","evidence":[{"fact_base_id":"q2058991$1C793578-246E-421C-967E-1C85097DB43E","locator":"wikipedia:en:pageid=32323663:revid=1366802861#extract[70:73]","revision_id":1366802861,"source_key":"wikipedia:en","source_url":"https://en.wikipedia.org/w/index.php?curid=32323663&oldid=1366802861"}],"explanation":"The source associates I'm Your Man with 2PM.","fact_base_ids":["q2058991$1C793578-246E-421C-967E-1C85097DB43E"],"group_ids":["Q222760"],"id":"f0753156be0971b221b46c413ae02bc4fead1448e0cd3614d24047ee7f3bfef9","language":"en","logical_id":"fe3facc149101a7fe093bbdc4ca19e2c8470edf509182960a0746f63d7e413c9","options":[{"id":"afc5f9e1c9344d90dc180d8e80d1d91e40680b8a60c4141c1afa7889d217b402","label":"April","value":"Q20858387","value_type":"group"},{"id":"ada70d5d98ec240e3583cf5888a73f5d621591864c6884dd0736e1bc0f3d08a7","label":"2PM","value":"Q222760","value_type":"group"},{"id":"b73c87cd6ca3bfc36385cdc2a9b1790c8710e8e9ba7df62eafd2c6c5270a12d4","label":"After School","value":"Q389067","value_type":"group"},{"id":"8cae46e2915233c7ceb3b3e6c21afc8a98cd29de147ac332cf386c379b961e51","label":"2NE1","value":"Q171885","value_type":"group"}],"prompt":"Which of these groups released I'm Your Man?","reference_date":"2026-09-13","semantic_id":"bed17cbf7bb90ab246dd23c1df14a1e30d798e1298a206f0e4beb08d116d7841","theme":"discography","type":"group_for_release"},{"answer_option_id":"05982a2b6329b4e515f88be1686290ec35a2affae3eb764d0e9bc18a192c831b","difficulty":"easy","evidence":[{"fact_base_id":"Q19263660$E6925E02-E0A9-4BCF-BBEC-E8D12BB100E0","locator":"wikipedia:en:pageid=45236847:revid=1366995864#extract[68:71]","revision_id":1366995864,"source_key":"wikipedia:en","source_url":"https://en.wikipedia.org/w/index.php?curid=45236847&oldid=1366995864"}],"explanation":"The source associates Guilty Love with 2PM.","fact_base_ids":["Q19263660$E6925E02-E0A9-4BCF-BBEC-E8D12BB100E0"],"group_ids":["Q222760"],"id":"caf43b2d1c9508f7336d5d61b389c7dbc90688a4543690c7ef7515538d305176","language":"en","logical_id":"209114de312f35524694ac7e095c09487d03aeed7efa189a46d7f5f75c5d22e9","options":[{"id":"0660ab3f1045bd04f50c20e399f10b0b41895d2beb25d31c7525b1e6bf5ac543","label":"Snow Pink","value":"Q487884","value_type":"release"},{"id":"05982a2b6329b4e515f88be1686290ec35a2affae3eb764d0e9bc18a192c831b","label":"Guilty Love","value":"Q19263660","value_type":"release"},{"id":"a599b027721f353314e1e89683893bb2b8242d2ae922b968ba1e6225d86cc185","label":"LEMONADE","value":"Q139579448","value_type":"release"},{"id":"78bba58428f283276f3ad32c4054b6052e232745b03d20182b0a7fad43eb0d2a","label":"Pink Up","value":"Q30922084","value_type":"release"}],"prompt":"Which of these rel